key,en,zh-Hans,zh-Hant,af,ar,ca,de,el,es,fi,fr,ga,hi,hr,hu,id,it,ja,ko,nl,no,pl,pt,ro,ru,sr,sv,sw,th,tr,vi
error.user_info_not_found,User info not found,未找到用户信息,未找到用戶信息,Gebruikersinformatie niet gevonden,معلومات المستخدم غير موجودة,Informació de l'usuari no trobada,Benutzerinformationen nicht gefunden,Δεν βρέθηκαν πληροφορίες χρήστη,Información del usuario no encontrada,Käyttäjätietoja ei löytynyt,Informations utilisateur non trouvées,Informació de l'usuari no trobada,उपयोगकर्ता जानकारी नहीं मिली,Podaci o korisniku nisu pronađeni,Felhasználói információk nem találhatók,Informasi pengguna tidak ditemukan,Informazioni utente non trovate,ユーザー情報が見つかりません,사용자 정보를 찾을 수 없습니다,Gebruikersinformatie niet gevonden,Finner ikke brukerinformasjon,Nie znaleziono informacji o użytkowniku,Informações do usuário não encontradas,Informațiile despre utilizator nu au fost găsite,Информация о пользователе не найдена,Korisničke informacije nisu pronađene,Det gick inte att hitta användarinformationen,Maelezo ya mtumiaji hayapatikani,ไม่พบข้อมูลผู้ใช้,Kullanıcı bilgisi bulunamadı,Không tìm thấy thông tin người dùng
error.failed_to_load_items,Failed to load items:,加载项目失败：,加载项目失败：,Kan items niet laden:,فشل تحميل العناصر:,Error al carregar els elements:,Fehler beim Laden von Elementen:,Αποτυχία φόρτωσης στοιχείων:,Error al cargar elementos:,Kohteiden lataaminen epäonnistui:,Échec du chargement des éléments :,Error al carregar elements:,आइटम लोड करने में विफल:,Neuspješno učitavanje stavki:,Az elemek betöltése nem sikerült:,Gagal memuat item:,Caricamento elementi non riuscito:,アイテムの読み込みに失敗しました：,항목을 로드하지 못했습니다:,Kan items niet laden:,Kunne ikke laste inn elementer:,Nie udało się załadować elementów:,Falha ao carregar itens:,Încărcarea elementelor nu a reușit:,Не удалось загрузить элементы:,Učitavanje stavki nije uspelo:,Det gick inte att ladda objekt:,Imeshindwa kupakia vipengee:,ไม่สามารถโหลดรายการ:,Öğeler yüklenemedi:,Không tải được mục:
action.watch,Watch,观看,觀看,Bekijken,شاهد,Visualitza,Ansehen,Παρακολούθηση,Ver,Katso,Kijken,Visualitza,Tv देखें,Gledaj,Néz,Menonton,Guarda,見る,보기,Bekijken,Ver,Ver,Ver,Ver,Ver,Pogledaj,İzle,Ver,Assistir,İzle,Xem
video.views,Views,观看次数,觀看次數,Weergaven,المشاهدات,Visualitzacions,Aufrufe,Προβολές,Vistas,Katselukerrat,Vues,Visualitzacions,दृश्य,Pogledi,Megtekintések,Tayangan,Visualizzazioni,ビュー,조회수,Weergaven,Visualizações,Visualizaciones,Visualizaciones,Visualizaciones,Visualizaciones,Pregledi,İzlenme,Visualizações,İzlenme,Görünümler,Views
video.likes,Likes,喜欢,喜歡,Vind-ik-leuks,إعجاب,Like,Mögen,Μου αρέσει,Gustos,Tykkäykset,J'aime,M'agrada,पसंद,Glasovi,Tetszik,Suka,Like,いいね,좋아요,Vind-ik-leuks,Gostos,Gustos,Gustos,Gustos,Glasovi,Beğenme,Gostos,Beğenme,ชอบ,Seviyor,Thích
video.comments,Comments,评论,評論,Reacties,تعليقات,Comentaris,Kommentare,Σχόλια,Comentarios,Kommentit,Commentaires,Comentaris,टिप्पणियाँ,Komentari,Hozzászólások,Komentar,Komenti,コメント,댓글,Reacties,Comentários,Comentarios,Comentarios,Comentarios,Komentari,Yorumlar,Comentários,Yorumlar,ความ คิด เห็น,Yorum,Ý kiến
title.pro_feature,Pro Feature,Pro 功能,Pro 功能,Pro-functie,ميزة الاحترافية,Funció Pro,Pro-Funktion,Λειτουργία Pro,Función Pro,Pro-ominaisuus,Fonction Pro,Funció Pro,प्रो विशेषता,Pro funkcija,Pro funkció,Fitur Pro,Caratteristica Pro,Pro機能,Pro 기능,Pro-functie,Recurso Pro,Función Pro,Función Pro,Función Pro,Pro funkcija,Pro Özelliği,Recurso Pro,Pro Özelliği,คุณสมบัติ Pro,Profesyonel Özellik,Tính năng Pro
action.upgrade_to_pro,Upgrade to Pro,升级到 Pro,升級到 Pro,Upgrade naar Pro,الترقية إلى النسخة المحترفة,Actualitza a Pro,Upgrade auf Pro,Αναβάθμιση σε Pro,Actualizar a Pro,Päivitä Pro-versioon,Mettre à niveau vers Pro,Actualitza a Pro,प्रो में अपग्रेड करें,Nadogradnja na Pro,Frissítés Pro verzióra,Upgrade ke Pro,Aggiorna a Pro,Proにアップグレード,Pro로 업그레이드,Upgrade naar Pro,Atualizar para Pro,Actualizar a Pro,Actualizar a Pro,Actualizar a Pro,Nadogradnja na Pro,Pro'ya Yükselt,Atualizar para Pro,Pro'ya Yükselt,อัปเกรดเป็น Pro,Pro'ya yükseltin,Nâng cấp lên Pro
msg.pro_transcript,Upgrade to Pro to view the full transcript!,升级到 Pro 以查看完整的字幕！,升級到 Pro 以查看完整的字幕！,Upgrade naar Pro om de volledige transcriptie te bekijken!,الترقية إلى النسخة المحترفة لعرض النص الكامل!,Actualitza a Pro per veure la transcripció completa!,Upgrade auf Pro, um die vollständige Transkription zu sehen!,Αναβαθμίστε σε Pro για να δείτε την πλήρη μεταγραφή!,¡Actualiza a Pro para ver la transcripción completa!,Päivitä Pro-versioon nähdäksesi koko transkriptio!,Mettez à niveau vers Pro pour voir la transcription complète!,Actualitza a Pro per veure la transcripció completa!,पूर्ण प्रतिलेख देखने के लिए Pro पर अपग्र,Frissítsen Pro-ra a teljes átirat megtekintéséhez!,Tingkatkan ke Pro untuk melihat transkrip lengkap!,Esegui l'upgrade a Pro per visualizzare la trascrizione completa!,Proにアップグレードして、完全なトランスクリプトを表示してください!,Pro로 업그레이드하여 전체 대본을 확인하세요!,Upgrade naar Pro om het volledige transcript te bekijken!,Oppgrader til Pro for å se hele transkripsjonen!,"Uaktualnij do wersji Pro, aby wyświetlić pełną transkrypcję!",Atualize para o Pro para ver a transcrição completa!,Faceți upgrade la Pro pentru a vizualiza transcrierea completă!,Перейдите на Pro для просмотра полной стенограммы!,Nadogradite na Pro da biste videli ceo transkript!,Uppgradera till Pro för att se hela utskriften!,Boresha kwa Pro ili kuona nakala kamili!,อัปเกรดเป็น Pro เพื่อดูการถอดเสียงฉบับเต็ม!,Tam transkripti görüntülemek için Pro'ya yükseltin!,Nâng cấp lên Pro để xem bảng điểm đầy đủ!
msg.pro_transcript_limit_reached,Transcript limit reached. Please upgrade to Pro to access more transcripts.,已达到字幕限制。请升级到 Pro 以访问更多字幕。,已達到字幕限制。,Transkripsie limiet bereik. Gradeer asseblief op na Pro om toegang tot meer transkripsies te kry.,تم الوصول إلى حد النص. يرجى الترقية إلى Pro للوصول إلى المزيد من النصوص.,Límit de transcripció assolit. Actualitzeu a Pro per accedir a més transcripcions.,"Transkript-Limit erreicht. Bitte aktualisieren Sie auf Pro, um auf weitere Transkripte zugreifen zu können.",Συμπληρώθηκε το όριο μεταγραφής. Αναβαθμίστε σε Pro για να αποκτήσετε πρόσβαση σε περισσότερες μεταγραφές.,Se ha alcanzado el límite de transcripciones. Actualice a Pro para acceder a más transcripciones.,Transkriptioraja saavutettu. Päivitä Pro-versioon saadaksesi lisää transkriptioita.,Limite de transcription atteinte. Veuillez passer à Pro pour accéder à plus de transcriptions.,Sroicheadh teorainn trascríbhinne. Déan uasghrádú ar Pro chun rochtain a fháil ar níos mó tras-scríbhinní.,प्रतिलेख सीमा तक पहुँच गया. अधिक टेप तक पहुंचने के लिए कृपया प्रो में अपग्रेड करें।,Dosegnuto je ograničenje transkripta. Nadogradite na Pro da biste pristupili većem broju transkripata.,"Elérte az átirati korlátot. Kérjük, frissítsen Pro-ra, hogy további átiratokhoz férjen hozzá.",Batas transkrip tercapai. Harap tingkatkan ke Pro untuk mengakses lebih banyak transkrip.,Limite di trascrizione raggiunto. Si prega di eseguire l'upgrade a Pro per accedere a più trascrizioni.,字幕の制限に達しました。より多くのトランスクリプトにアクセスするには、Proにアップグレードしてください。,대본 제한에 도달했습니다. 더 많은 대본에 액세스하려면 Pro로 업그레이드하십시오.,Transcriptielimiet bereikt. Upgrade naar Pro om toegang te krijgen tot meer transcripties.,Transkripsjonsgrense nådd. Oppgrader til Pro for å få tilgang til flere transkripsjoner.,"Osiągnięto limit transkrypcji. Uaktualnij do wersji Pro, aby uzyskać dostęp do większej liczby transkrypcji.",Limite de transcrição atingido. Atualize para o Pro para acessar mais transcrições.,Limita de transcriere a fost atinsă. Vă rugăm să faceți upgrade la Pro pentru a accesa mai multe transcrieri.,"Достигнут лимит стенограммы. Пожалуйста, обновите статус до Pro, чтобы получить доступ к большему количеству стенограмм.",Dostignuta granica transkripta. Nadogradite na Pro da biste pristupili još transkripta.,Avskriftsgränsen har nåtts. Uppgradera till Pro för att få tillgång till fler utskrifter.,Ukomo wa Transcript umefikiwa. Tafadhali sasisha hadi Pro ili kufikia nakala zaidi.,ถึงขีดจํากัดการถอดเสียงแล้ว โปรดอัปเกรดเป็น Pro เพื่อเข้าถึงการถอดเสียงเพิ่มเติม,Transkript sınırına ulaşıldı. Daha fazla transkripte erişmek için lütfen Pro'ya yükseltin.,Đã đạt đến giới hạn bảng điểm. Vui lòng nâng cấp lên Pro để truy cập thêm bảng điểm.
action.speak,Speak,朗读,朗讀,Spreken,تحدث,Parla,Sprechen,Μιλήστε,Hablar,Puhu,Parler,Parla,बोलें,Govori,Beszél,Bicara,Parla,話す,말하기,Spreken,Falar,Hablar,Hablar,Hablar,Govori,Konuş,Conversar,Konuş,พูด,Speak,Nói
action.copy,Copy,复制,複製,Kopiëren,نسخ,Kopiar,Kopieren,Αντιγραφή,Copiar,Kopioi,Copier,Copiar,कॉपी,Kopiraj,Másol,Salin,Copia,コピー,복사,Kopiëren,Copiar,Copiar,Copiar,Copiar,Kopiraj,Kopyala,Copiar,Kopyala,Sao chép,Kopyala,Sao chép
msg.copy_success,Text copied to clipboard,文本已复制到剪贴板,文本已複製到剪貼板,Tekst gekopieerd naar klembord,تم نسخ النص إلى الحافظة,Text copiat al porta-retalls,Text in die Zwischenablage kopiert,Το κείμενο αντιγράφηκε στο πρόχειρο,Texto copiado al portapapeles,Teksti kopioitu leikepöydälle,Texte copié dans le presse-papiers,Text copiat,पाठ क्लिपबोर्ड पर कॉपी किया गया,Tekst kopiran u međuspremnik,Kijelölt szöveg másolva,Salin teks ke papan klip,Testo copiato negli appunti,テキストがクリップボードにコピーされました,텍스트가 클립보드에 복사되었습니다,Tekst gekopieerd naar klembord,Texto copiado,Copiado,Copiado,Copiado,Kopirano,Kopyalandı,Copiado,Kopyalandı,Đã sao chép văn bản,Panoya kopyalanan metin,Văn bản được sao chép vào khay nhớ tạm
chatgpt.prompt.base,"Succinctly explain using {{l1Name}}, what the {{l2Name}} ({{l2Code}}) word '{{word}}' means in the phrase '{{text}}'.",使用{{l1Name}}简洁地解释{{l2Name}}（{{l2Code}}）单词“{{word}}”在短语“{{text}}”中的含义。,使用{{l1Name}}簡潔地解釋{{l2Name}}（{{l2Code}}）單詞“{{word}}”在短語“{{text}}”中的含義。,"Verduidelik bondig met {{l1Name}}, wat die {{l2Name}} ({{l2Code}}) woord '{{word}}' beteken in die frase '{{text}}'.","اشرح بإيجاز باستخدام {{l1Name}} ما تعنيه كلمة PLACEHOLDER3{{l2Name}} ({{l2Code}}) في عبارة ""{{text}}"".","Expliqueu succintament amb {{l1Name}}, què vol dir la paraula {{l2Name}} ({{l2Code}}) ""{{word}}"" a la frase ""{{text}}"".","Erklären Sie kurz und bündig mit {{l1Name}}, was das {{l2Name}} ({{l2Code}}) Wort '{{word}}' in der Phrase '{{text}}' bedeutet.","Εξηγήστε συνοπτικά χρησιμοποιώντας {{l1Name}}, τι σημαίνει η λέξη {{l2Name}} ({{l2Code}}) '{{word}}' στη φράση '{{text}}'.","Explique sucintamente usando {{l1Name}}, lo que significa la palabra {{l2Name}} ({{l2Code}}) '{{word}}' en la frase '{{text}}'.","Selitä lyhyesti {{l1Name}} avulla, mitä {{l2Name}} ({{l2Code}}) -sana ""{{word}}"" tarkoittaa lauseessa ""{{text}}"".","Expliquez succinctement en utilisant {{l1Name}}, ce que le mot {{l2Name}}} ({{l2Code}}}) '{{word}}' signifie dans l’expression '{{text}}'.","Mínigh go gonta ag baint úsáide as {{l1Name}}, cad is brí leis an bhfocal {{l2Name}} ({{l2Code}}) '{{word}}' san abairt '{{text}}'.",{{l1Name}} का प्रयोग करके संक्षेप में समझाइए कि '{{l2Name}}' वाक्यांश '{{text}}' में {{}}} ({{l2Code}}) शब्द PLACEHOLDER3 का क्या अर्थ है?,"Sažeto objasnite koristeći {{{l1Name}}, što {{l2Name}} ({{l2Code}}) znači riječ '{{{word}}' u izrazu '{{{text}}'.","Röviden magyarázza el a {{l1Name}} használatával, hogy mit jelent a {{l2Name}} ({{l2Code}}) szó '{{word}}' a '{{text}}' kifejezésben.","Jelaskan secara ringkas menggunakan {{l1Name}}, apa arti kata {{l2Name}} ({{l2Code}}) '{{word}}' dalam frasa '{{text}}'.","Spiega brevemente usando {{l1Name}}, cosa significa la parola {{l2Name}} ({{l2Code}}) '{{word}}' nella frase '{{text}}'.",{{l2Name}}({{l2Code}})という単語「{{word}}」が「{{text}}」というフレーズで何を意味するのかを{{l1Name}}を使って簡潔に説明します。,'{{l2Name}} ({{l2Code}}) 단어 '{{word}}'가 '{{text}'에서 무엇을 의미하는지 {{l1Name}}를 사용하여 간결하게 설명하십시오.,"Leg kort en bondig uit met behulp van {{l1Name}}, wat het {{l2Name}} ({{l2Code}}) woord '{{word}}' betekent in de zin '{{text}}'.","Forklar kortfattet med {{l1Name}}, hva ordet {{l2Name}} ({{l2Code}}) betyr i uttrykket '{{PLACEHOLDER3 PLACEHOLDER4}}}'.","Zwięźle wyjaśnij, używając {{l1Name}}, co oznacza słowo {{l2Name}} ({{l2Code}}) ""{{word}}"" w wyrażeniu ""{{text}}}"".","Explique sucintamente usando {{l1Name}}, o que a palavra {{l2Name}} ({{l2Code}}) significa '{{word}}' na frase '{{text}}'.","Explicați succint folosind {{l1Name}}, ce înseamnă cuvântul {{l2Name}} ({{l2Code}}) din expresia ""{{PLACEHOLDER3 PLACEHOLDER4}}}"".","Кратко объясните, используя {{l1Name}}, что означает {{l2Name}} ({{l2Code}}) слово '{{word}}' во фразе '{{text}}'.","Sažeto objasnite koristeći {{l1Name}}, šta znači reč {{l2Name}} ({{l2Code}}) ""{{word}}PLACEHOLDER4"".",Förklara kortfattat med {{l1Name}} vad ordet {{l2Name}} ({{l2Code}}) {{word}}' betyder i frasen '{{text}}'.,"Kwa ufupi eleza kwa kutumia {{l1Name}}, neno {{l2Name}} ({{l2Code}}) neno '{{word}}' linamaanisha katika kishazi '{{text}}'.",อธิบายอย่างรวบรัดโดยใช้ {{l1Name}}}คําว่า {{l2Name}} ({{l2Code}}}) คําว่า '{{word}}}' หมายถึงอะไรในวลี '{{text}}',"{{l1Name}} kullanarak, '{{l2Name}} ({{l2Code}}) '{{word}}' ifadesindeki '{{}}}' kelime PLACEHOLDER4 sinin ne anlama geldiğini kısaca açıklayın.","Giải thích ngắn gọn bằng cách sử dụng {{l1Name}}, từ {{l2Name}} ({{l2Code}}) '{{word}}' có nghĩa là gì trong cụm từ '{{text}}'."
chatgpt.prompt.inflection,"Give its lemma, inflection, and morphology.",给出它的原型、变形和构词。,給出它的原型、變形和構詞。,"Gee sy lemma, verbuiging en morfologie.",أعط ليما ، انعطاف ، ومورفولوجيا.,"Doneu-li lema, inflexió i morfologia.","Geben Sie das Lemma, die Flexion und die Morphologie an.","Δώστε το λήμμα, την κλίση και τη μορφολογία του.","Dé su lema, inflexión y morfología.","Anna sen lemma, taivutus ja morfologia.","Donnez son lemme, son inflexion et sa morphologie.","Tabhair a lemma, infhilleadh, agus deilbhíocht.","इसकी लेम्मा, विभक्ति और आकृति विज्ञान दें।","Dajte mu lemmu, infleksiju i morfologiju.","Adja meg lemmáját, inflexióját és morfológiáját.","Berikan lemma, infleksi, dan morfologinya.","Fornisci il suo lemma, la flessione e la morfologia.",その補題、語形変化、形態を与えてください。,"기본형, 굴절 및 형태를 제공하십시오.","Geef het lemma, de verbuiging en de morfologie.","Gi dens lemma, bøyning og morfologi.","Podaj jego lemat, fleksję i morfologię.","Dê seu lema, inflexão e morfologia.","Dați-i lema, inflexiunea și morfologia.","Укажите его лемму, перегиб и морфологию.","Daj joj lemu, inflekciju i morfologiju.","Ge dess lemma, böjning och morfologi.","Kutoa lemma yake, inflection, na morphology.",ให้คําหลักการผันและสัณฐานวิทยา,"Lemmasını, bükülmesini ve morfolojisini verin.","Đưa ra lemma, biến tố và hình thái của nó."
action.let_chatgpt_explain,Ask AI,让 AI 解释,讓 AI 解釋,Laat AI uitleggen,اسأل الذكاء الاصطناعي,Deixa que l'IA ho expliqui,Lassen Sie die KI erklären,Ερωτήστε την τεχνητή νοημοσύνη,Deja que la IA lo explique,Anna tekoälyn selittää,Permettez à l'IA d'expliquer,Deixa que l'IA ho expliqui,एआई से पूछें,Neka AI objasni,Hadd AI magyarázza el,Biarkan AI menjelaskan,Lascia che l'IA spieghi,人工知能に尋ねる,인공지능에게 물어보기,Vraag AI,Deixe a IA explicar,Deja que la IA lo explique,Deja que la IA lo explique,Deja que la IA lo explique,Neka AI objasni,AI'ya sor,Deixe a IA explicar,Deixe a IA explicar,Hỏi AI,Haydi AI anlatsın,Hỏi AI
msg.pro_feature_chatgpt,"Only Pro users can use AI features in Language Player Go. To use this feature, upgrade to Pro.",只有 Pro 用户才能在 Language Player Go 中使用 AI 功能。要使用此功能，请升级到 Pro。,只有 Pro 用戶才能在 Language Player Go 中使用 AI 功能。要使用此功能，請升級到 Pro。,"Alleen Pro-gebruikers kunnen AI-functies in Language Player Go gebruiken. Om deze functie te gebruiken, upgrade naar Pro.",يمكن لمستخدمي Pro فقط استخدام ميزات الذكاء الاصطناعي في Language Player Go. لاستخدام هذه الميزة، قم بالترقية إلى Pro.,"Només els usuaris Pro poden utilitzar les funcions d'IA a Language Player Go. Per utilitzar aquesta funció, actualitza a Pro.","Nur Pro-Benutzer können KI-Funktionen in Language Player Go verwenden. Um diese Funktion zu verwenden, aktualisieren Sie auf Pro.","Μόνο οι χρήστες Pro μπορούν να χρησιμοποιήσουν τις λειτουργίες τεχνητής νοημοσύνης στο Language Player Go. Για να χρησιμοποιήσετε αυτήν τη λειτουργία, αναβαθμίστε σε Pro.","Solo los usuarios Pro pueden usar funciones de IA en Language Player Go. Para usar esta función, actualiza a Pro.","Vain Pro-käyttäjät voivat käyttää tekoälyn ominaisuuksia Language Player Go -sovelluksessa. Käyttääksesi tätä ominaisuutta, päivitä Pro-versioon.","Seuls les utilisateurs Pro peuvent utiliser les fonctionnalités d'IA dans Language Player Go. Pour utiliser cette fonctionnalité, passez à Pro.","Ní féidir ach le húsáideoirí Pro gnéithe AI a úsáid i Language Player Go. Chun an ghné seo a úsáid, uasghrádú go Pro.","केवल प्रो उपयोगकर्ता ही लैंग्वेज प्लेयर गो में एआई सुविधाओं का उपयोग कर सकते हैं। इस सुविधा का उपयोग करने के लिए, प्रो में अपग्रेड करें।","Samo Pro korisnici mogu koristiti značajke umjetne inteligencije u aplikaciji Language Player Go. Da biste koristili ovu značajku, nadogradite na Pro.",Csak a Pro felhasználók használhatják a Language Player Go AI funkcióit. A funkció használatához frissítsen Pro-ra.,"Hanya pengguna Pro yang dapat menggunakan fitur AI di Language Player Go. Untuk menggunakan fitur ini, tingkatkan ke Pro.","Solo gli utenti Pro possono utilizzare le funzionalità AI in Language Player Go. Per utilizzare questa funzione, eseguire l'aggiornamento a Pro.",Language Player Go で AI 機能を使用できるのは Pro ユーザーのみです。この機能を使用するには、Pro にアップグレードしてください。,Pro 사용자만 Language Player Go에서 AI 기능을 사용할 수 있습니다. 이 기능을 사용하려면 Pro로 업그레이드하십시오.,"Alleen Pro-gebruikers kunnen AI-functies gebruiken in Language Player Go. Als u deze functie wilt gebruiken, moet u upgraden naar Pro.","Bare Pro-brukere kan bruke AI-funksjoner i Language Player Go. For å bruke denne funksjonen, oppgrader til Pro.","Tylko użytkownicy wersji Pro mogą korzystać z funkcji sztucznej inteligencji w Language Player Go. Aby korzystać z tej funkcji, uaktualnij do wersji Pro.","Apenas usuários Pro podem usar recursos de IA no Language Player Go. Para usar esse recurso, atualize para o Pro.","Numai utilizatorii Pro pot utiliza funcțiile AI în Language Player Go. Pentru a utiliza această caracteristică, faceți upgrade la Pro.","Только пользователи Pro могут использовать функции ИИ в Language Player Go. Чтобы использовать эту функцию, выполните обновление до Pro.","Samo Pro korisnici mogu da koriste AI funkcije u programu Language Player Go. Da biste koristili ovu funkciju, nadogradite na Pro.",Endast Pro-användare kan använda AI-funktioner i Language Player Go. Om du vill använda den här funktionen uppgraderar du till Pro.,"Watumiaji wa Pro tu ndio wanaweza kutumia vipengele vya AI katika Kicheza Lugha Go. Ili kutumia kipengele hiki, boresha hadi Pro.",เฉพาะผู้ใช้ Pro เท่านั้นที่สามารถใช้คุณสมบัติ AI ใน Language Player Go ได้ หากต้องการใช้คุณสมบัตินี้ ให้อัปเกรดเป็น Pro,Language Player Go'da AI özelliklerini yalnızca Pro kullanıcıları kullanabilir. Bu özelliği kullanmak için Pro'ya yükseltin.,"Chỉ người dùng Pro mới có thể sử dụng các tính năng AI trong Language Player Go. Để sử dụng tính năng này, hãy nâng cấp lên Pro."
log.loading_dictionary,Loading the dictionary...,正在加载字典...,正在加載字典...,Het woordenboek wordt geladen...,جاري تحميل القاموس...,Carregant el diccionari...,Wörterbuch wird geladen...,Φόρτωση του λεξικού...,Cargando el diccionario...,Ladataan sanakirjaa...,Chargement du dictionnaire...,Carregant el diccionari...,शब्दकोश लोड हो रहा है...,Učitavanje rječnika...,Szótár betöltése...,Memuat kamus...,Caricamento del dizionario...,辞書を読み込んでいます...,사전을 로드하는 중...,Woordenboek wordt geladen...,Carregando o dicionário...,Cargando el diccionario...,Cargando el diccionario...,Cargando el diccionario...,Učitavanje rječnika...,Sözlük yükleniyor...,Carregando o dicionário...,Sözlük yükleniyor...,กำลังโหลดพจนานุกรม...,Sözlük yükleniyor...,Đang tải từ điển...
log.dictionary_ready,Dictionary is ready and loaded.,字典已加载就绪。,字典已加載就緒。,Woordenboek is klaar en geladen.,تم تحميل القاموس وجاهز.,El diccionari està llest i carregat.,Wörterbuch ist bereit und geladen.,Το λεξικό είναι έτοιμο και φορτώθηκε.,El diccionario está listo y cargado.,Sanakirja on valmis ja ladattu.,Le dictionnaire est prêt et chargé.,El diccionari està llest i carregat.,शब्दकोश तैयार है और लोड हो गया है।,Rječnik je spreman i učitan.,A szótár készen áll és betöltve.,Kamus siap dan dimuat.,Dizionario pronto e caricato.,辞書が準備され、読み込まれました。,사전이 준비되었으며 로드되었습니다.,Woordenboek is klaar en geladen.,Dicionário pronto e carregado.,Diccionario listo y cargado.,Diccionario listo y cargado.,Diccionario listo y cargado.,Rječnik je spreman i učitan.,Sözlük hazır ve yüklendi.,Dicionário pronto e carregado.,Sözlük hazır ve yüklendi.,พจนานุกรมพร้อมและถูกโหลดแล้ว.,Sözlük hazır ve yüklendi.,Từ điển đã sẵn sàng và được tải.
